[
    {
        "chapter_id": 1,
        "book_id": 3,
        "arabic": "كتاب الطهارة",
        "english": "The Book of Purification",
        "bangla": "পবিত্রতার বই"
    },
    {
        "chapter_id": 2,
        "book_id": 3,
        "arabic": "كتاب المياه",
        "english": "The Book of Water",
        "bangla": "পানির বই"
    },
    {
        "chapter_id": 3,
        "book_id": 3,
        "arabic": "كتاب الحيض والاستحاضة",
        "english": "The Book of Menstruation and Istihadah",
        "bangla": "ঋতুস্রাব ও ইস্তিহাদার বই"
    },
    {
        "chapter_id": 4,
        "book_id": 3,
        "arabic": "كتاب الغسل والتيمم",
        "english": "The Book of Ghusl and Tayammum",
        "bangla": "গোসল ও তায়াম্মুমের বই"
    },
    {
        "chapter_id": 5,
        "book_id": 3,
        "arabic": "كتاب الصلاة",
        "english": "The Book of Salah",
        "bangla": "নামাজের বই"
    },
    {
        "chapter_id": 6,
        "book_id": 3,
        "arabic": "كتاب المواقيت",
        "english": "The Book of the Times (of Prayer)",
        "bangla": "নামাজের সময়ের বই"
    },
    {
        "chapter_id": 7,
        "book_id": 3,
        "arabic": "كتاب الأذان",
        "english": "The Book of the Adhan (The Call to Prayer)",
        "bangla": "আজানের বই"
    },
    {
        "chapter_id": 8,
        "book_id": 3,
        "arabic": "كتاب المساجد",
        "english": "The Book of the Masjids",
        "bangla": "মসজিদের বই"
    },
    {
        "chapter_id": 9,
        "book_id": 3,
        "arabic": "كتاب القبلة",
        "english": "The Book of the Qiblah",
        "bangla": "কিবলার বই"
    },
    {
        "chapter_id": 10,
        "book_id": 3,
        "arabic": "كتاب الإمامة",
        "english": "The Book of Leading the Prayer (Al-Imamah)",
        "bangla": "ইমামতির বই"
    },
    {
        "chapter_id": 11,
        "book_id": 3,
        "arabic": "كتاب الافتتاح",
        "english": "The Book of the Commencement of the Prayer",
        "bangla": "নামাজ শুরু করার বই"
    },
    {
        "chapter_id": 12,
        "book_id": 3,
        "arabic": "كتاب التطبيق",
        "english": "The Book of The At-Tatbiq (Clasping One's Hands Together)",
        "bangla": "হাত জোড় করার বই"
    },
    {
        "chapter_id": 13,
        "book_id": 3,
        "arabic": "كتاب السهو",
        "english": "The Book of Forgetfulness (In Prayer)",
        "bangla": "নামাজে ভুল-ভ্রান্তির বই"
    },
    {
        "chapter_id": 14,
        "book_id": 3,
        "arabic": "كتاب الجمعة",
        "english": "The Book of Jumu'ah (Friday Prayer)",
        "bangla": "জুমার নামাজের বই"
    },
    {
        "chapter_id": 15,
        "book_id": 3,
        "arabic": "كتاب تقصير الصلاة فى السفر",
        "english": "The Book of Shortening the Prayer When Traveling",
        "bangla": "ভ্রমণে নামাজ সংক্ষিপ্ত করার বই"
    },
    {
        "chapter_id": 16,
        "book_id": 3,
        "arabic": "كتاب الكسوف",
        "english": "The Book of Eclipses",
        "bangla": "সূর্য ও চন্দ্রগ্রহণের নামাজের বই"
    },
    {
        "chapter_id": 17,
        "book_id": 3,
        "arabic": "كتاب الاستسقاء",
        "english": "The Book of Praying for Rain (Al-Istisqa')",
        "bangla": "বৃষ্টির জন্য নামাজের বই"
    },
    {
        "chapter_id": 18,
        "book_id": 3,
        "arabic": "كتاب صلاة الخوف",
        "english": "The Book of the Fear Prayer",
        "bangla": "ভয়ের নামাজের বই"
    },
    {
        "chapter_id": 19,
        "book_id": 3,
        "arabic": "كتاب صلاة العيدين",
        "english": "The Book of the Prayer for the Two 'Eids",
        "bangla": "ঈদের নামাজের বই"
    },
    {
        "chapter_id": 20,
        "book_id": 3,
        "arabic": "كتاب قيام الليل وتطوع النهار",
        "english": "The Book of Qiyam Al-Lail (The Night Prayer) and Voluntary Prayers During the Day",
        "bangla": "রাতের নামাজ ও দিনের নফল নামাজের বই"
    },
    {
        "chapter_id": 21,
        "book_id": 3,
        "arabic": "كتاب الجنائز",
        "english": "The Book of Funerals",
        "bangla": "জানাজার বই"
    },
    {
        "chapter_id": 22,
        "book_id": 3,
        "arabic": "كتاب الصيام",
        "english": "The Book of Fasting",
        "bangla": "রোজার বই"
    },
    {
        "chapter_id": 23,
        "book_id": 3,
        "arabic": "كتاب الزكاة",
        "english": "The Book of Zakah",
        "bangla": "যাকাতের বই"
    },
    {
        "chapter_id": 24,
        "book_id": 3,
        "arabic": "كتاب مناسك الحج",
        "english": "The Book of Hajj",
        "bangla": "হজের বই"
    },
    {
        "chapter_id": 25,
        "book_id": 3,
        "arabic": "كتاب الجهاد",
        "english": "The Book of Jihad",
        "bangla": "জিহাদের বই"
    },
    {
        "chapter_id": 26,
        "book_id": 3,
        "arabic": "كتاب النكاح",
        "english": "The Book of Marriage",
        "bangla": "বিয়ের বই"
    },
    {
        "chapter_id": 27,
        "book_id": 3,
        "arabic": "كتاب الطلاق",
        "english": "The Book of Divorce",
        "bangla": "তালাকের বই"
    },
    {
        "chapter_id": 28,
        "book_id": 3,
        "arabic": "كتاب الخيل",
        "english": "The Book of Horses, Races and Shooting",
        "bangla": "ঘোড়া, দৌড় ও তীরন্দাজির বই"
    },
    {
        "chapter_id": 29,
        "book_id": 3,
        "arabic": "كتاب الإحباس",
        "english": "The Book of Endowments",
        "bangla": "ওয়াকফের বই"
    },
    {
        "chapter_id": 30,
        "book_id": 3,
        "arabic": "كتاب الوصايا",
        "english": "The Book of Wills",
        "bangla": "উইলের বই"
    },
    {
        "chapter_id": 31,
        "book_id": 3,
        "arabic": "كتاب النحل",
        "english": "The Book of Presents",
        "bangla": "উপহারের বই"
    },
    {
        "chapter_id": 32,
        "book_id": 3,
        "arabic": "كتاب الهبة",
        "english": "The Book of Gifts",
        "bangla": "উপহার ও দানের বই"
    },
    {
        "chapter_id": 33,
        "book_id": 3,
        "arabic": "كتاب الرقبى",
        "english": "The Book of ar-Ruqba",
        "bangla": "রুকবা সম্পর্কিত বই"
    },
    {
        "chapter_id": 34,
        "book_id": 3,
        "arabic": "كتاب العمرى",
        "english": "The Book of 'Umra",
        "bangla": "উমরা সম্পর্কিত বই"
    },
    {
        "chapter_id": 35,
        "book_id": 3,
        "arabic": "كتاب الأيمان والنذور",
        "english": "The Book of Oaths and Vows",
        "bangla": "শপথ ও মানতের বই"
    },
    {
        "chapter_id": null,
        "book_id": 3,
        "arabic": "كتاب المزارعة",
        "english": "The Book of Agriculture",
        "bangla": "কৃষির বই"
    },
    {
        "chapter_id": 36,
        "book_id": 3,
        "arabic": "كتاب عشرة النساء",
        "english": "The Book of the Kind Treatment of Women",
        "bangla": "নারীদের সদ্ব্যবহারের বই"
    },
    {
        "chapter_id": 37,
        "book_id": 3,
        "arabic": "كتاب تحريم الدم",
        "english": "The Book of Fighting [The Prohibition of Bloodshed]",
        "bangla": "রক্তপাত নিষিদ্ধকরণের বই"
    },
    {
        "chapter_id": 38,
        "book_id": 3,
        "arabic": "كتاب قسم الفىء",
        "english": "The Book of Distribution of Al-Fay'",
        "bangla": "ফাই বিতরণের বই"
    },
    {
        "chapter_id": 39,
        "book_id": 3,
        "arabic": "كتاب البيعة",
        "english": "The Book of al-Bay'ah",
        "bangla": "বাইআতের বই"
    },
    {
        "chapter_id": 40,
        "book_id": 3,
        "arabic": "كتاب العقيقة",
        "english": "The Book of al-'Aqiqah",
        "bangla": "আকিকার বই"
    },
    {
        "chapter_id": 41,
        "book_id": 3,
        "arabic": "كتاب الفرع والعتيرة",
        "english": "The Book of al-Fara' and al-'Atirah",
        "bangla": "ফারাআ ও আতীরার বই"
    },
    {
        "chapter_id": 42,
        "book_id": 3,
        "arabic": "كتاب الصيد والذبائح",
        "english": "The Book of Hunting and Slaughtering",
        "bangla": "শিকার ও জবাইয়ের বই"
    },
    {
        "chapter_id": 43,
        "book_id": 3,
        "arabic": "كتاب الضحايا",
        "english": "The Book of ad-Dahaya (Sacrifices)",
        "bangla": "কুরবানির বই"
    },
    {
        "chapter_id": 44,
        "book_id": 3,
        "arabic": "كتاب البيوع",
        "english": "The Book of Financial Transactions",
        "bangla": "লেনদেনের বই"
    },
    {
        "chapter_id": 45,
        "book_id": 3,
        "arabic": "كتاب القسامة",
        "english": "The Book of Oaths (qasamah), Retaliation and Blood Money",
        "bangla": "শপথ, প্রতিশোধ ও রক্তপণ সংক্রান্ত বই"
    },
    {
        "chapter_id": 46,
        "book_id": 3,
        "arabic": "كتاب قطع السارق",
        "english": "The Book of Cutting off the Hand of the Thief",
        "bangla": "চোরের হাত কর্তনের বই"
    },
    {
        "chapter_id": 47,
        "book_id": 3,
        "arabic": "كتاب الإيمان وشرائعه",
        "english": "The Book Of Faith and its Signs",
        "bangla": "ঈমান ও তার নিদর্শনের বই"
    },
    {
        "chapter_id": 48,
        "book_id": 3,
        "arabic": "كتاب الزينة من السنن",
        "english": "The Book of Adornment",
        "bangla": "শোভা ও অলংকারের বই"
    },
    {
        "chapter_id": 49,
        "book_id": 3,
        "arabic": "كتاب آداب القضاة",
        "english": "The Book of the Etiquette of Judges",
        "bangla": "বিচারকদের শিষ্টাচারের বই"
    },
    {
        "chapter_id": 50,
        "book_id": 3,
        "arabic": "كتاب الاستعاذة",
        "english": "The Book of Seeking Refuge with Allah",
        "bangla": "আল্লাহর আশ্রয় প্রার্থনার বই"
    },
    {
        "chapter_id": 51,
        "book_id": 3,
        "arabic": "كتاب الأشربة",
        "english": "The Book of Drinks",
        "bangla": "পানীয়ের বই"
    }
]